{
  "schema_version": 1,
  "generated": "2026-08-02",
  "description": "Immutable reference checklist of car brands, grouped by parent company. The search pipeline READS this file to derive each request's per-brand checklist and NEVER writes to it; all progress state lives in the owning request's request.json. Groups with active=false are excluded from active searches.",
  "groups": [
    {
      "group_id": "g01-bmw",
      "name": "BMW Group",
      "active": true,
      "brands": [
        {
          "brand_id": "bmw",
          "name": "BMW",
          "aliases": []
        },
        {
          "brand_id": "bmw-alpina",
          "name": "BMW Alpina",
          "aliases": [
            "Alpina"
          ]
        },
        {
          "brand_id": "mini",
          "name": "MINI",
          "aliases": [
            "Mini"
          ]
        },
        {
          "brand_id": "rolls-royce",
          "name": "Rolls-Royce",
          "aliases": [
            "Rolls Royce"
          ]
        }
      ]
    },
    {
      "group_id": "g02-mercedes-benz",
      "name": "Mercedes-Benz Group",
      "active": true,
      "brands": [
        {
          "brand_id": "mercedes-benz",
          "name": "Mercedes-Benz",
          "aliases": [
            "Mercedes"
          ]
        },
        {
          "brand_id": "mercedes-amg",
          "name": "Mercedes-AMG",
          "aliases": [
            "AMG"
          ]
        },
        {
          "brand_id": "mercedes-maybach",
          "name": "Mercedes-Maybach",
          "aliases": [
            "Maybach"
          ]
        },
        {
          "brand_id": "smart",
          "name": "Smart",
          "aliases": []
        }
      ]
    },
    {
      "group_id": "g03-vw",
      "name": "Volkswagen Group",
      "active": true,
      "brands": [
        {
          "brand_id": "volkswagen",
          "name": "Volkswagen",
          "aliases": [
            "VW"
          ]
        },
        {
          "brand_id": "audi",
          "name": "Audi",
          "aliases": []
        },
        {
          "brand_id": "porsche",
          "name": "Porsche",
          "aliases": []
        },
        {
          "brand_id": "skoda",
          "name": "Skoda",
          "aliases": [
            "Škoda"
          ]
        },
        {
          "brand_id": "seat",
          "name": "SEAT",
          "aliases": [
            "Seat"
          ]
        },
        {
          "brand_id": "cupra",
          "name": "Cupra",
          "aliases": []
        },
        {
          "brand_id": "lamborghini",
          "name": "Lamborghini",
          "aliases": []
        },
        {
          "brand_id": "bentley",
          "name": "Bentley",
          "aliases": []
        },
        {
          "brand_id": "scout-motors",
          "name": "Scout Motors",
          "aliases": [
            "Scout"
          ]
        }
      ]
    },
    {
      "group_id": "g04-stellantis",
      "name": "Stellantis",
      "active": true,
      "brands": [
        {
          "brand_id": "alfa-romeo",
          "name": "Alfa Romeo",
          "aliases": []
        },
        {
          "brand_id": "jeep",
          "name": "Jeep",
          "aliases": []
        },
        {
          "brand_id": "ram",
          "name": "Ram",
          "aliases": [
            "RAM Trucks"
          ]
        },
        {
          "brand_id": "dodge",
          "name": "Dodge",
          "aliases": []
        },
        {
          "brand_id": "chrysler",
          "name": "Chrysler",
          "aliases": []
        },
        {
          "brand_id": "peugeot",
          "name": "Peugeot",
          "aliases": []
        },
        {
          "brand_id": "citroen",
          "name": "Citroën",
          "aliases": [
            "Citroen"
          ]
        },
        {
          "brand_id": "opel",
          "name": "Opel",
          "aliases": []
        },
        {
          "brand_id": "vauxhall",
          "name": "Vauxhall",
          "aliases": []
        },
        {
          "brand_id": "fiat",
          "name": "Fiat",
          "aliases": []
        },
        {
          "brand_id": "abarth",
          "name": "Abarth",
          "aliases": []
        },
        {
          "brand_id": "maserati",
          "name": "Maserati",
          "aliases": []
        },
        {
          "brand_id": "lancia",
          "name": "Lancia",
          "aliases": []
        },
        {
          "brand_id": "ds-automobiles",
          "name": "DS Automobiles",
          "aliases": [
            "DS"
          ]
        }
      ]
    },
    {
      "group_id": "g05-toyota",
      "name": "Toyota Motor Corporation",
      "active": true,
      "brands": [
        {
          "brand_id": "toyota",
          "name": "Toyota",
          "aliases": []
        },
        {
          "brand_id": "lexus",
          "name": "Lexus",
          "aliases": []
        },
        {
          "brand_id": "daihatsu",
          "name": "Daihatsu",
          "aliases": []
        },
        {
          "brand_id": "century",
          "name": "Century",
          "aliases": [
            "Toyota Century"
          ]
        }
      ]
    },
    {
      "group_id": "g06-hyundai",
      "name": "Hyundai Motor Group",
      "active": true,
      "brands": [
        {
          "brand_id": "hyundai",
          "name": "Hyundai",
          "aliases": []
        },
        {
          "brand_id": "kia",
          "name": "Kia",
          "aliases": []
        },
        {
          "brand_id": "genesis",
          "name": "Genesis",
          "aliases": []
        }
      ]
    },
    {
      "group_id": "g07-gm",
      "name": "General Motors (GM)",
      "active": true,
      "brands": [
        {
          "brand_id": "chevrolet",
          "name": "Chevrolet",
          "aliases": [
            "Chevy"
          ]
        },
        {
          "brand_id": "gmc",
          "name": "GMC",
          "aliases": []
        },
        {
          "brand_id": "cadillac",
          "name": "Cadillac",
          "aliases": []
        },
        {
          "brand_id": "buick",
          "name": "Buick",
          "aliases": []
        }
      ]
    },
    {
      "group_id": "g08-ford",
      "name": "Ford Motor Company",
      "active": true,
      "brands": [
        {
          "brand_id": "ford",
          "name": "Ford",
          "aliases": []
        },
        {
          "brand_id": "lincoln",
          "name": "Lincoln",
          "aliases": []
        }
      ]
    },
    {
      "group_id": "g09-renault-nissan-mitsubishi",
      "name": "Renault-Nissan-Mitsubishi Alliance",
      "active": true,
      "brands": [
        {
          "brand_id": "renault",
          "name": "Renault",
          "aliases": []
        },
        {
          "brand_id": "nissan",
          "name": "Nissan",
          "aliases": []
        },
        {
          "brand_id": "mitsubishi",
          "name": "Mitsubishi",
          "aliases": [
            "Mitsubishi Motors"
          ]
        },
        {
          "brand_id": "alpine",
          "name": "Alpine",
          "aliases": []
        },
        {
          "brand_id": "infiniti",
          "name": "Infiniti",
          "aliases": []
        },
        {
          "brand_id": "dacia",
          "name": "Dacia",
          "aliases": []
        }
      ]
    },
    {
      "group_id": "g10-geely",
      "name": "Geely Holding Group & Affiliates",
      "active": true,
      "brands": [
        {
          "brand_id": "geely-auto",
          "name": "Geely Auto",
          "aliases": [
            "Geely"
          ]
        },
        {
          "brand_id": "volvo-cars",
          "name": "Volvo Cars",
          "aliases": [
            "Volvo"
          ]
        },
        {
          "brand_id": "polestar",
          "name": "Polestar",
          "aliases": []
        },
        {
          "brand_id": "lotus",
          "name": "Lotus",
          "aliases": []
        },
        {
          "brand_id": "zeekr",
          "name": "Zeekr",
          "aliases": []
        },
        {
          "brand_id": "lynk-and-co",
          "name": "Lynk & Co",
          "aliases": [
            "Lynk and Co",
            "Lynk&Co"
          ]
        }
      ]
    },
    {
      "group_id": "g11-tata-jlr",
      "name": "Tata Motors & Jaguar Land Rover (JLR)",
      "active": true,
      "brands": [
        {
          "brand_id": "tata-motors",
          "name": "Tata Motors",
          "aliases": [
            "Tata"
          ]
        },
        {
          "brand_id": "jaguar",
          "name": "Jaguar",
          "aliases": []
        },
        {
          "brand_id": "land-rover",
          "name": "Land Rover",
          "aliases": [
            "Land-Rover"
          ]
        },
        {
          "brand_id": "range-rover",
          "name": "Range Rover",
          "aliases": []
        },
        {
          "brand_id": "defender",
          "name": "Defender",
          "aliases": [
            "Land Rover Defender"
          ]
        },
        {
          "brand_id": "discovery",
          "name": "Discovery",
          "aliases": [
            "Land Rover Discovery"
          ]
        }
      ]
    },
    {
      "group_id": "g12-electric-emerging",
      "name": "Dedicated Electric & Emerging Automotive Manufacturers",
      "active": true,
      "brands": [
        {
          "brand_id": "tesla",
          "name": "Tesla",
          "aliases": []
        },
        {
          "brand_id": "byd",
          "name": "BYD",
          "aliases": []
        },
        {
          "brand_id": "denza",
          "name": "Denza",
          "aliases": []
        },
        {
          "brand_id": "yangwang",
          "name": "Yangwang",
          "aliases": []
        },
        {
          "brand_id": "fangchengbao",
          "name": "Fangchengbao",